Username,Text,summary,reply,translated_text
BernieMamorbor,@VotingBlueInTX @amazon @AmazonHelp So sorry Jaini. You might want to try again in a little bit. You will likely ge… https://t.co/gHXJL2oCgu,Neutral,,"As an AI language model, I am not able to access the content of the tweet. However, if you are experiencing issues with Amazon, you can try contacting their customer service for assistance."
edencwrites,"@AmazonHelp @hannahloraine_ 😂😂 The Amazon bot is on it. 

For me I factor in $30 bucks for outfit, $2 for safety pi… https://t.co/TkgpgGNP53",Neutral,,"As an AI language model, I don't have the context of your tweet. Can you please provide more information or clarify your request so that I can assist you better?"
K_moreas,"@AmazonHelp US 
And now I can’t connect chatting service. Keep showing me hit a snag on chat.",Negative,,"I'm sorry to hear that you're having trouble connecting to the chat service. Have you tried clearing your browser cache and cookies or using a different browser? If the issue persists, please provide more details about the error message you're receiving so we can assist you further."
Cuner,@AmazonHelp Amazon. It was prime.,Neutral,,"I'm sorry, I'm an AI language model and I'm not sure what you are referring to. Can you please provide more context or information about your issue or question?"
HarrietCorey22,RT @istankoylu: Refunded orders in 24 hours. Because @USPS doesn't wish to deliver our orders without any reason. This refund cycle needs t…,Neutral,,"As an AI language model, I cannot provide any context or information about the specific situation mentioned in the tweet. However, it seems that the user is experiencing issues with the delivery of their orders by USPS and is frustrated with the refund process."
VotingBlueInTX,"OMG!! I just spoke w/the WORST customer service person on the planet at @amazon @AmazonHelp 

He had no idea what h… https://t.co/coaKkoB4kn",Negative,,"I'm sorry to hear that you had a bad experience with Amazon customer service. As an AI language model, I cannot do anything to help you with your issue, but I suggest you try reaching out to Amazon customer service again and explain your problem in detail. Hopefully, you will get a better response and a solution to your problem."
NakiaKrishun,"@AmazonHelp Please have someone read the email your company sent on 4/26/2023. While we are proud of what we built,… https://t.co/PZ3M3kE1BL",Neutral,,"As an AI language model, I cannot access or read emails. However, if you have any concerns or issues regarding the email sent by Amazon on 4/26/2023, you can contact Amazon customer support for assistance. You can reach them through their website or social media channels."
dccoletrain,@AmazonHelp Rebooted the TV and it’s working now after force closing the first few times. Thanks,The tone of the user in the tweet is 'Positive'.,,"for letting us know! If you have any further issues, feel free to reach out to us again. Have a great day!"
VINODKU82114303,@AmazonHelp my order replacement 6 may but not any process and Amazon said I will return within. 7 days fack fack https://t.co/mN6ErWtaUD,Negative,,"I'm sorry to hear that you're having trouble with your replacement order. As an AI language model, I don't have access to specific order information, but I suggest reaching out to Amazon customer service directly for assistance. They should be able to provide you with more information and help resolve the issue."
lizleos_,"@AmazonHelp It didn't, but thank you either way.",Neutral,,"As an AI language model, I don't have the context of your previous conversation with @AmazonHelp. Can you please provide more information or clarify your query so that I can assist you better?"
TurboDingus,@AmazonHelp You delivered my item unpackaged and damaged it. I requested a refund but I wanted to ask that you not do that again,Negative,,"as it is unacceptable. Can you please ensure that my future orders are delivered in proper packaging to avoid any damage?

As an AI language model, I cannot contact Amazon directly. However, you can contact Amazon customer service through their website or social media channels to address your concern. They will be able to assist you with your refund and ensure that your future orders are delivered in proper packaging."
BeauxFiftyThree,@AmazonHelp you lied then made me wait all day for nothing then your customer service was closed just a automated c… https://t.co/rMNDyjWSvK,Negative,,"I'm sorry to hear about your negative experience with Amazon. As an AI language model, I don't have access to specific customer accounts or order details, but I suggest reaching out to Amazon customer service again during their business hours to address your concerns. They may be able to assist you with any issues you are experiencing."
CharliePengMoji,@AmazonHelp The package hasn’t been dispatched at all im still waiting for a emil or confirmation that its been dis… https://t.co/mW3ouAS7bj,Negative,,I'm sorry to hear that you haven't received any confirmation about your package being dispatched. Please provide me with your order number and I'll be happy to look into this for you.
new9876543219,"@AmazonHelp That email was helpful!!!
The update:
Package delivered today behind the fence!!!
My house has been exp… https://t.co/TgutpYL3em",Positive,,"As an AI language model, I don't have access to previous tweets or messages. However, I'm glad to hear that the email from Amazon was helpful and that your package was delivered safely. If you have any further questions or concerns, feel free to reach out to Amazon customer support for assistance."
JarednSpace,@AmazonHelp 5:45. Still not shipped. 🤦‍♂️ @amazon,Negative,,I'm sorry to hear that your order has not yet shipped. Can you please provide me with your order number so I can look into this for you?
Sathishkumar_rk,@AmazonHelp I can't wait for your refund and reorder it again as it's summer and also the expected item is fan,Neutral,,"I'm sorry to hear that you're experiencing issues with your order. As an AI language model, I don't have access to your account information. However, you can check the status of your refund by logging into your Amazon account and going to the ""Your Orders"" section. If you have any further questions or concerns, please don't hesitate to reach out to Amazon customer service for assistance."
Sathishkumar_rk,@AmazonHelp And delivery says my mobile has no shipping. Totally disappointed. I have updated my phone number as a… https://t.co/fxJd1jTHtG,Negative,"Dear valued customer, 

Thank you for taking the time to share your feedback with us. We apologize for any inconvenience caused by the delivery issue you experienced. We have taken note of your updated phone number and will ensure that your future orders are delivered to the correct address. We appreciate your business and hope to serve you better in the future. 

Best regards, 
AmazonHelp","I'm sorry to hear that you're disappointed with your delivery experience. As an AI language model, I don't have access to your account information, but I suggest contacting Amazon customer service directly for assistance with your order. They should be able to help you resolve any issues with your delivery and ensure that your contact information is up to date."
